,Date,title,score,url,num_comments,body
120,2023-04-16,Can re-orgs happen on L2s? And how deep can they go?,23,https://www.reddit.com/r/ethereum/comments/12nqvfq/can_reorgs_happen_on_l2s_and_how_deep_can_they_go/,8,"Basically the title. I know re-orgs are possible on L1 although I think less frequent with proof of stake. But what happens on L2s? Is it specific to each imeplementation?

&#x200B;

Any resources would be awesome"
121,2023-04-16,Question about Matic and ETH,17,https://www.reddit.com/r/ethereum/comments/12nqhua/question_about_matic_and_eth/,6,Im using Metamask and its connected to the polygon network. If I post a NFT and someone sends ETH via opensea. Since Im logged in to opensea via metamask thats connected to the polygon network. Will that pose some kind of issue? or would I be able to sell the ETH normally with out some weird conversion.
122,2023-04-16,Is burning rate correct?,12,https://www.reddit.com/r/ethereum/comments/12nsetj/is_burning_rate_correct/,23,"I have been looking at the supply chart of Ethereum since the move to PoS and recently after the new upgrade the supply has reduced faster compared to before the upgrade.
1) is it healthy for the network to burn ether this fast rather than paying stakers more?
2) is it possible that there is wrong with the supply charts?"
123,2023-04-15,I own ETH. I also own a small amount of Grayscale Ethereum Trust.,79,https://www.reddit.com/r/ethereum/comments/12n02kr/i_own_eth_i_also_own_a_small_amount_of_grayscale/,65,"I’d like to hear some opinions on Grayscale Ethereum trust, some purists hate the product."
124,2023-04-15,bitcoin vs ethereum transaction fees question,44,https://www.reddit.com/r/ethereum/comments/12mqjgv/bitcoin_vs_ethereum_transaction_fees_question/,18,"

As block rewards decrease and transaction fees go up to compensate miners. What will happen to people holding small amounts of bitcoin on private wallets. Will there btc become essentially stuck when transaction fees exceed the holdings in that wallet? How will bitcoin get around this problem? 

Will this lead to everyone eventually moving to ethereum"
125,2023-04-15,EIP-4844 ready for Multi-Client Devnets,35,https://etherworld.co/2023/04/15/eip-4844-ready-for-multi-client-devnets/,1,"- EIP-4844 Specs Updated
- Prysm EIP-4844 Progress
- Layer 2 Teams
- Blob Transaction Mempool Design & Implementation
- Data Gas Field & Execution API"
126,2023-04-14,ETH staking on Coinbase vs. via LIDO on Ledger Live,154,https://www.reddit.com/r/ethereum/comments/12meqyd/eth_staking_on_coinbase_vs_via_lido_on_ledger_live/,65,"I've had some ETH staked and locked on Coinbase for the last two years, and now that it's unlocked, I'm consider moving it over to my Ledger and staking via LIDO on Ledger Live.

I'm curious if anyone can share a perspective on risk profile of these two options. I get that on Coinbase 'not your keys, not your crypto'. However, I don't know much about LIDO risks aside from the standard 'there's risk with smart contract code vulnerabilities' etc.

Note: Please only reply to thread and no DMs. I'll mark as spam, so don't bother."
127,2023-04-15,The Xircus hackathon aims to bring together developers,14,https://www.reddit.com/r/ethereum/comments/12mujek/the_xircus_hackathon_aims_to_bring_together/,1,"The Xircus hackathon aims to bring together developers, entrepreneurs, and technology enthusiasts to create a platform for innovation and problem-solving."
128,2023-04-15,how long should syncing take with checkpoint sync using geth/prysm?,11,https://www.reddit.com/r/ethereum/comments/12mwc53/how_long_should_syncing_take_with_checkpoint_sync/,7,"I haven't messed around with Ethereum in a few years and the new proof-of-stake upgrade has forced me to relearn a lot of the tools I already had scripts set up for.

After realizing I had to run a beacon node to transact with geth I started everything up and it seems to be working...but the sync messages are telling me it's going to take another 15 hours to ""state download in progress"" and ""chain download in progress.""  Have I messed something up or is this realistically how long it takes to sync up before I can do anything with my old wallet?

To clarify what my goal here is, I'd just like to send what meager funds I have left in my wallet to someone else.  What's the most simple way to go about doing this?

&#x200B;

More info:

Intel 8 core CPU

8GB RAM

500GB SSD

good internet connection

&#x200B;

EDIT:  


Just going to import to MetaMask but still curious about the process in general since I've already done this much work."
129,2023-04-15,Latest Week in Ethereum News,53,https://weekinethereumnews.com/week-in-ethereum-news-april-15-2023,4,
130,2023-04-15,ERC-20 validators,22,https://www.reddit.com/r/ethereum/comments/12mjy1w/erc20_validators/,6,"Do erc-20 tokens need their own network validators, or are their transactions secured by Ethereum validators? Thanks!"
131,2023-04-15,What is RopstenETH and why do I have so much of it?,7,https://www.reddit.com/r/ethereum/comments/12mqe7l/what_is_ropsteneth_and_why_do_i_have_so_much_of_it/,7,"I opened an old MM wallet to find a lot of this token, any info - can't seem to find anything o:"
132,2023-04-14,Uniswap Wallet is available now,67,https://blog.uniswap.org/uniswap-mobile-wallet-release,20,
133,2023-04-14,zkSync Twitter Account Hacked,72,https://twitter.com/unsnarl_secure/status/1646874639510179841,4,"📢@zksync team has told its users to stay alert 🚨 until it's confirmed by @the_matter_labs & @gluk64.
They are also requesting 🙏@TwitterSupport & @elonmusk to respond to their support requests!"
134,2023-04-15,"ETH funds transfer issue from coinbase to BYBIT, anyone experiences something similar?",4,https://www.reddit.com/r/ethereum/comments/12mqa7m/eth_funds_transfer_issue_from_coinbase_to_bybit/,2,"So I sent funds to my account using coinbase, I just downloaded Bybit. Sent a test deposit from Coinbase to Bybit and it worked fine (10 minute wait). Sent the larger fund afterward, been over an hour so I contacted customer support. They said I sent via smart contract so I have to fill out a recovery form, I just filled one out and they said they are going to there recovery team. I am very anxious and scared, has anyone been through this? Is Bybit good about recovering funds? I checked Etherscan and the money is there, just not in bybit."
135,2023-04-14,ETH staking with Ledger,14,https://www.reddit.com/r/ethereum/comments/12meizr/eth_staking_with_ledger/,16,Has anyone staked their ETH using Ledger Live? It looks like there's no minimum and no holding period. I'm just a little leary about it and don't really know what the risks are (of any).
136,2023-04-14,Transient Storage: Temporary Space on a Permanent Blockchain,32,https://www.reddit.com/r/ethereum/comments/12m123p/transient_storage_temporary_space_on_a_permanent/,6,"# Introduction

Transient Storage creates a place in a block with temporary data for Ethereum transactions. The benefits are significant gas savings for users, for rollups, and in making certain aspects of smart contracts more secure. We often take for granted the permanence of data on the blockchain, but there is value in being able to store temporary data too.

https://preview.redd.it/ef9u81hz9vta1.png?width=577&format=png&auto=webp&v=enabled&s=a23e13c14f6256c2b435d97ff3ac32c39220eca0

&#x200B;

# Contract Storage on Ethereum

Whenever a smart contract is deployed to Ethereum, it receives an amount of storage that it can use to hold data. This storage contains everything a contract may need; whitelisted addresses, who the contract owner is, what the balances of token holders are, and so on.

When one of these pieces of data needs to be updated, like changing the owner of a contract for example, a transaction is submitted with the old owner’s address as well as the new owner’s. This rewrites the data held in contract storage, and a record of the old contract owner is maintained in the transaction history.

The problem is that this operation of writing or rewriting data to the blockchain is the most expensive operation that can be performed (it involves updating Ethereum’s state trie, which you can [read about here](https://ramiwrites.substack.com/p/merkle-trees-how-blockchain-data)). Despite the cost, this operation happens frequently out of necessity. 

&#x200B;

# Memory Storage

If a contract’s storage is the hard drive, you can think of memory storage as the RAM. Memory storage is where a contract stores the data it actually uses when performing a transaction (retrieving the old contract owner’s name and updating it with the new one, for example). Once a transaction is finalized, any relevant new values in memory storage are posted or updated in contract storage, i.e. the expensive transaction. Everything that shouldn’t be posted to contract storage is deleted.

https://preview.redd.it/1bl3ma52avta1.png?width=500&format=png&auto=webp&v=enabled&s=83179d256f75a3ed4b9b46f0b63d8d6c8fdc00b3

One might wonder if memory storage is sufficient to allow “transient storage,” a place for temporary data to exist for the duration of a transaction. This suspicion is somewhat correct, and there are some implementations of transient storage on Ethereum today that do things this way. There are however limitations to using memory storage as a temporary data source that necessitate transient storage as a new feature.

&#x200B;

# EIP-1153: Transient Storage

EIP-1153 creates a new space in blocks to hold data temporarily while a transaction is executed. This approach to transient storage delivers several benefits that are explained below, including cheaper deployment of some contracts, cheaper costs for rollups reporting their state to Ethereum, and protection from re-entrancy attacks.

https://preview.redd.it/ahk2ntu3avta1.png?width=636&format=png&auto=webp&v=enabled&s=c7e899d53c5cff526d57ab6977a9d5e30dbf416c

&#x200B;

# Cheaper Contract Deployment

Many contracts today allow users to create completely new contracts, as in Uniswap when creating a new liquidity pool to swap two assets, or when setting up a new NFT contract with Manifold. When users use Uniswap or Manifold for this purpose, the contract they interact with “initializes” the new contract with some basic parameters. To do this it’ll have some generic data like the structure of the liquidity pool, or code compliant to the standard of ERC-721. Alongside the generic data there’ll also be some individual data that describes the specific assets in a pool or the fee it charges for trades, or the name of an NFT smart contract.

EIP-1153 enables the generic data (init code) to always stay the same by instead passing the individual data (constructor arguments) into transient storage. This method saves gas costs on deployments of these types of contracts since individual data is not posted on-chain.

&#x200B;

# Rollup Storage

Rollups aggregate transactions and submit them together to Ethereum in batches. When rollups submit to Ethereum, they submit the proof (the result of all the transactions), as well as the data executed itself. The data is published so that the proof can be verified as valid.

Transient storage can allow rollups to generate their proofs more efficiently. This reduces gas costs for all rollup submissions, and by extension, all transactions on rollups.

https://preview.redd.it/6x9aw4d5avta1.png?width=521&format=png&auto=webp&v=enabled&s=3a138a7e3623441739c78453cefe95d503347946

Read more [about rollups here](https://ramiwrites.substack.com/p/guide-to-the-layer-2-landscape).

&#x200B;

# Re-Entrancy Attacks

A re-entrancy attack happens when a transaction is able to withdraw assets from a contract multiple times before stopping, often draining a contract of its funds. This happens when a vulnerable contract sends assets out first, then updates its balance afterwards. A re-entrancy attack gets in the middle of those two actions, preventing the vulnerable contract from updating its balance and allowing the attacker to drain it of its funds.

Re-entrancy attacks can be prevented with properly planned code, but transient storage makes them even easier to mitigate. By storing information about a withdrawal in transient storage, withdrawals will happen only for pre-determined amounts.

&#x200B;

# In Conclusion

Transient storage can reduce gas costs across a variety of complex smart contracts. This enables using dApps more cost-effectively while also enabling novel applications on Ethereum. Someone has already [developed a way](https://hackmd.io/@7-EMZFyUQNeY0Ttk6APiXA/r1rHOZ8mo#) to give someone a quick, instant loan while keeping custody of the funds.

While transient storage benefits users, the bigger benefit is to the protocols that use it. Uniswap and Optimism have pushed aggressively for transient storage to be included in the Shanghai upgrade instead of staking withdrawals. The controversy around that motivated me to start this newsletter to keep people informed on developments in Ethereum. My hope is this information enables people to understand where Ethereum is going, and to add your voice on where you think that should be.

&#x200B;

This write-up is a summary of the full version from my free newsletter!

Visit below, and consider signing up! You'll receive a write-up on blockchain every other week 🫡

[https://ramiwrites.substack.com/p/transient-storage-temporary-space?sd=pf](https://ramiwrites.substack.com/p/transient-storage-temporary-space?sd=pf)

&#x200B;

Stay kind. Stay curious."
137,2023-04-14,"Shapella Successfully deployed, closing the PoS loop for Ethereum",254,https://etherworld.co/2023/04/13/shapella-successfully-deployed-closing-the-pos-loop-for-ethereum/,20,"Shapella upgrade, Prysm bug, Lighthouse fix, Ethereum network health at the time of upgrade, FAQ and more!"
138,2023-04-14,What tool would be useful for you but doesn't exist?,11,https://www.reddit.com/r/ethereum/comments/12m6gis/what_tool_would_be_useful_for_you_but_doesnt_exist/,9,"Is there anything in particular that you believe would bring you some value, while either doing SC development or just interacting with Ethereum network, that does not exist? 

I'm doing some research on the painpoints that people from Ethereum community are facing. And after identifying them, I would like to try to solve some. 

I'm very passionate about creating products that could bring value to others. It can be anything from an open-source tool to a service in form of a startup product. 

I'd love to hear your thoughts!"
139,2023-04-14,Ethereum’s Long-Awaited Network Upgrade has Arrived: What’s Next?,19,https://zionodesoc.medium.com/bitcoin-breaks-30k-barrier-ethereum-implements-network-upgrade-and-ftx-considers-relaunching-51d4d6041947,3,
140,2023-04-14,Looking to set up my own validator,7,https://www.reddit.com/r/ethereum/comments/12m9csa/looking_to_set_up_my_own_validator/,4,"Hey all, 

I'm sure this has been asked ad nauseam but can someone point me to the best/most recent video on how to build/set up my own validator?

A couple quick questions-

Is a validator similar to a Bitcoin node where I will order parts (like a Raspberry Pi) and build it then install the software or is it going to be more like just running the software on a laptop?  

One thing I'm nervous about is getting slashed or having downtime with the validator that will cause me to lose my ETH.  Is this a legitimate concern?"
141,2023-04-14,US with new Plans for Mass Surveillance: Crypto as Our Last Line of Defense Against the Increasing Governmental Surveillance Overreach,28,https://www.reddit.com/r/ethereum/comments/12lqood/us_with_new_plans_for_mass_surveillance_crypto_as/,2,"The (US 🇺🇸) government's overreach into the lives of its citizens under the guise of national security is a concerning trend that undermines individual freedom, privacy, and the 1st Amendment. The recent case of leaked Pentagon documents on Discord, which went undetected for weeks, is misused by the Biden administration to consider expanding its monitoring of social media activities and chat rooms (https://www.nbcnews.com/politics/national-security/us-intel-agencies-missed-classified-documents-leaked-on-discord-rcna79404). In the case of the leaked Pentagon documents, the intelligence community's desire to prevent future leaks may result in the adoption of invasive surveillance methods. This move raises again important questions about the balance between security and our civil liberties, and it highlights the crucial role that cryptography and cryptocurrencies (e.g. tech like VPNs or Tornado Cash and projects like Monero) play in preserving our privacy.

The US 1st Amendment guarantees freedom of speech, religion, and the press, among other rights. Yet, the government's attempts to monitor online platforms and private chatrooms will erode these freedoms. Although public chatrooms may be considered fair game, law enforcement agencies actually do not have the legal authority to monitor private online chatrooms without a probable cause. Expanding surveillance efforts - e.g. under the guise of national security (https://www.reuters.com/article/us-usa-security-idUSBRE95910O20130612) - would inevitably risk violating these legal safeguards. The government seems striving to monitor not only our money and spending/saving (with CBDCs and social credit systems) but also wants to follow us on every step online going forward and being able to quickly censor if needed (e.g. https://nclalegal.org/2023/01/the-white-house-covid-censorship-machine/)

Cryptography and cryptocurrencies offer us some tooling to protect our privacy from the ever increasing, invasive government surveillance. By using encryption tools to secure data and communications like VPNs, we can shield our online activities from prying eyes, maintaining control over oit personal information. Similarly, our dear cryptocurrencies provide a level of financial privacy and autonomy that traditional banking systems cannot offer and CBDCs never will. It is clear that the governments have no interest in the proliferation and wide-scale use of these technologies by retail, so we observe hidden and increasingly visible attacks focusing on them as demonstrated with: the Tornado Cash case (https://www.forbes.com/sites/rosemariemiller/2022/10/26/tornado-cash-sanctions-by-us-treasury-draw-outrage-suits-from-crypto-community), attacks on privacy coins (https://www.thestreet.com/crypto/news/dubai-bans-all-privacy-coins), attacks on VPNs via the RESTRICT act (https://reason.com/2023/03/29/could-the-restrict-act-criminalize-the-use-of-vpns/) and attenpts to install chat controls (https://www.change.org/p/european-parliament-defend-our-privacy-vote-no-to-chat-control).

Therefore, I can only urge everyone to stay vigilant, push back surveillance agendas and educate as much people as possible about the importance of cash, cryptocurrencies and cryptography as well as the overreach of our governments. //Rant over

————————

TL;DR: 
The governments’ increasing tendency to expand its surveillance capabilities in the name of national security is a concerning development that poses a threat. The 1st Amendment and the legal safeguards designed to protect civil liberties must be upheld, and the use of cryptography and cryptocurrencies is crucial in preserving our privacy in an increasingly monitored environment!"
142,2023-04-14,BancorDAO just proposed their new trading protocol Carbon in governance and open-sourced the smart contracts,31,https://gov.bancor.network/t/proposing-carbon/4236,10,
143,2023-04-14,For those interested in Liquid Staking their ETH 👇,5,https://www.reddit.com/r/ethereum/comments/12m3vp7/for_those_interested_in_liquid_staking_their_eth/,1,"I wrote this thread to help the common-person understand LSTs and why they are such an easy and convenient way to stake. This was made in the context of the Swell protocol but mostly applies to other LSTs like Rocketpool, Stakewise, ect. If you like this and want to see more educational content like this, consider giving me a follow or retweet 😁

https://twitter.com/Suffuze/status/1637996773494112258?s=20

P.s. if interested is Swell, they are going live this month with the cheapest staking fee of all the LSTs. They are also running an Aquanauts program on discord (via roles) right now that they have said will be awarded. There's your Alpha 🤘"
144,2023-04-14,Will the Shanghai upgrade help decentralize the system?,11,https://www.reddit.com/r/ethereum/comments/12lvqkg/will_the_shanghai_upgrade_help_decentralize_the/,9,"Note: I'm new to eth and blockchain, so I no doubt have some gaps in knowledge.

With lending eth seemingly more profitable than staking pools, I assume many would choose to pull money out of Lido and coinbase staking pools. 

Does that mean that it would help decentralize the system since the two major players won't have as much control?"
145,2023-04-14,Exploring ERC-2535: The Diamond Standard for Smart Contracts,6,https://autifynetwork.com/exploring-erc-2535-the-diamond-standard-for-smart-contracts/,1,
146,2023-04-14,"I am exiting my staking position and are unsure of what to do with all the Eth (NOT SELLING), would like to know what the community thinks is the best use for Eth is right now, would you get into defi? explore layer 2s? provide liquidity? or is staking just the best option?",2,https://www.reddit.com/r/ethereum/comments/12mc3ju/i_am_exiting_my_staking_position_and_are_unsure/,19,What would you do? Havent been able to do much in the network since all my eth was locked for the last 25 months.
147,2023-04-14,Ethereum JSON Wallet,9,https://www.reddit.com/r/ethereum/comments/12lu7on/ethereum_json_wallet/,12,"Hey, I have a very old (\~6-7 years) Ethereum wallet that I made a while back. But since then I have lost the couple of sheets of paper I kept all the information about the wallet on. I now only have the JSON Keystore file and the password for it. I do not know how to decrypt it, or how to even use it. This is the format that the JSON file is in, and of course, I removed the data from it for this post XD. 

If someone helps me out with this and I can get it restored and working again, I would happily transfer you 0.25 - 0.5 ETH as a thank you!

    {
        ""address"":"""",
        ""crypto"":{
            ""cipher"":""aes-128-ctr"",
            ""ciphertext"":"""",
            ""cipherparams"":{
                ""iv"":""""
            },
            ""kdf"":""scrypt"",
            ""kdfparams"":{
                ""dklen"":32,
                ""n"":1024,
                ""r"":8,
                ""p"":1,
                ""salt"":""""
            },
            ""mac"":""""
        },
        ""id"":"""",
        ""client"":""MediShares\/Android"",
        ""version"":3
    }

How would I go about loading up and restoring this wallet again? I have been trying many different ways but I cannot figure it out.

I do not have the mnemonic phrase or the private key.

I would greatly appreciate any/all help, thank you!"
148,2023-04-13,PSA: Moving crypto between wallets is not taxable!,114,https://www.reddit.com/r/ethereum/comments/12kye2c/psa_moving_crypto_between_wallets_is_not_taxable/,51,"Hey everyone! Earlier this week, I made a post on taxes and someone asked me whether transferring crypto between wallets is taxable. I wanted to write up a longer post to explain the tax implications of wallet-to-wallet transfers in the US. 

The short answer is that moving crypto between wallets you own is NOT TAXABLE.

However, it’s still important to keep records of your wallet-to-wallet transfers for tax purposes. 

**Why you should keep records of wallet transfers**

Keeping complete records of crypto transactions will make it easier to calculate your capital gains and losses after a wallet-to-wallet transfer.

To better understand why this is important, consider the following scenario.

You buy $10,000 of ETH on Coinbase.

You transfer your crypto to a cold wallet.

You sell $15,000 of ETH on Gemini.

In this case, your capital gain should be $5,000. However, if you haven’t kept records of your capital gains and losses, you’ll be forced to recognize the entire $15,000 proceeds of your sale as a capital gain.

**What should I do if I haven’t been keeping records?**

If you haven’t been keeping records of your wallet-to-wallet transfers, don’t worry. You can look through your transaction history on your exchanges and wallets to find the price of your crypto at receipt and disposal — this will make it easier to calculate capital gains and losses.

If you’re having trouble with this or you just have a fuckton of transactions, you can use crypto tax software (like [CoinLedger](https://coinledger.io/), CoinTracker, or whatever other option you choose) to calculate your gains and losses across all your wallets and exchanges.

**Hey man, I tried crypto tax software and now I have a missing cost basis error!**

Many investors who use multiple wallets get a ‘missing cost basis’ error from their crypto tax platforms.

There are a few different reasons why you might get this error, but usually this happens when you’ve transferred your cryptocurrency between wallets and you haven’t connected all of your wallets and exchanges to the platform!

To calculate your capital gains, the crypto tax software you’re using needs to know your original cost basis for acquiring your crypto. That means you need to add all of your wallets and exchanges to the platform — even exchanges that you haven’t used in years. This way, the platform will have access to your complete transaction history.

**TL;DR:** Wallet-to-wallet transfers aren’t taxable, but they can fuck up reporting your taxes if you haven’t kept careful records."
