,Date,title,score,url,num_comments,body
0,2023-04-24,Frequently Asked Questions + Weekly Discussion Thread,125,https://www.reddit.com/r/ethereum/comments/12x59xp/frequently_asked_questions_weekly_discussion/,9,"**Welcome to the Weekly Discussion. Please read the disclaimer, guidelines, and rules before participating.**

Rules:

* All [sub rules](https://www.reddit.com/r/Ethereum/about/rules/) apply in this thread.
* Discussion topics must be related to Ethereum.
* Behave with civility and politeness. Do not use offensive, racist or homophobic language.
* Comments will be sorted by newest first.

Useful Links:

* [Ethereum.org](https://ethereum.org)
* [ETHMerge.com](https://ethmerge.com/)

**Reminder**

/r/ethereum is a community for discussing the technology, news, applications and community of Ethereum. **Discussion of the Ether price or trading is not allowed.** Please keep those discussions to [/r/ethfinance](https://www.reddit.com/r/ethfinance) and [/r/ethstaker](https://www.reddit.com/r/ethstaker).

&#x200B;

**Frequently Asked Questions**

**Where's the best place to buy ETH?**

There are many centralized exchanges that support Ethereum. If you live in the US, the most popular exchanges are Coinbase, Gemeni and Kraken. Coinbase users can use Coinbase Pro for lower fees.

**How can I stake my ETH?**

The best way to stake your ETH: by running your own validator.

* Running your own validator requires a modern computer and 32 ETH. Visit /r/ethstaker for more details

**Why are Ethereum transaction fees so high?**

Like most blockchains, Ethereum fees are determined by supply-and-demand. The large demand to use Ethereum has pushed transaction fees quite high (however, fees were just a few cents only 2 years ago). Fees are especially high during market volatility, and during NFT drops.

**What is being done to lower Ethereum transaction fees?**

Ethereum fees are reduced by using layer-2 rollups. Rollups are scaling solutions that allow for significantly cheaper transactions, while still maintaining Ethereum's security.

Additionally, data shards will make rollups even cheaper.

While rollups are cutting-edge technology being actively developed, a number are already live on Ethereum mainnet. Visit [l2beat.com](https://l2beat.com/) to learn more about rollups.

**What's the best wallet for Ethereum?**

The most popular tool for using decentralized applications is Metamask. However, for security reasons, we recommend using a hardware wallet such as a Trezor or Ledger.

&#x200B;

Are there questions you'd like to see added? Leave a comment below."
1,2023-04-26,Impressed with speed and cost of ETH.,182,https://www.reddit.com/r/ethereum/comments/12zibyw/impressed_with_speed_and_cost_of_eth/,147,"Bought 0.5 ETH today to add to my cold wallet and it cost me $1.63 to move it ($800+ worth) and it took less than 60 seconds to confirm. Hugely impressed as it’s been a while since I bought any and moved it. 

Just thought I’d post a happy user review as have seen a lot of posts moaning about GAS fees lately."
2,2023-04-26,What do you think of the 'Beneficial Ownership Information Report' in the Marshall Islands' new DAO Act?,25,https://www.reddit.com/r/ethereum/comments/12zpfrm/what_do_you_think_of_the_beneficial_ownership/,2,"The Marshall Islands' [new DAO Act](https://docsend.com/view/ramkt3e6af428rkv) requires any DAOs registering as an LLC in the country to submit an annual report providing the full name, DoB, address, passport number and digital wallet address of any individual/entity holding over 25% of the governance tokens in a DAO.

Thoughts on this? Is it a sensible compromise to encourage transparency? Is it an overstep? Can you see issues arising?"
3,2023-04-27,I don't understand something on ultrasound.money website...can you help me?,1,https://www.reddit.com/r/ethereum/comments/130ej31/i_dont_understand_something_on_ultrasoundmoney/,1,"So, last Saturday I noted on [ultrasound.money](https://ultrasound.money) website that eth supply went negative of -1%.

Today, independently by the time frame I set, the supply is negative of only -0,7%.

The first explication that came to my mind was that eth went inflationary again for some time due to lower activity on the network.

But, the base fee window reports that eth has always been deflationary for the last 30 days. So, how's possible that the supply went up on the last few days (from -1% to -0,7%) with a persistent deflationary status of eth during the last 30 days?"
4,2023-04-26,Introduction to EIP-2535 Diamonds,22,https://eip2535diamonds.substack.com/p/introduction-to-the-diamond-standard,7,
5,2023-04-26,Any Smart account dApp created since EIP4337?,25,https://www.reddit.com/r/ethereum/comments/12zhfx2/any_smart_account_dapp_created_since_eip4337/,2,"Hi!  


I believe EIP4337 is a huge step towards Blockchain mass adoption, thanks to UX improvements it unlocks.

Do you any project that leverages EIP4337 improvements?

I recently heard about Avocado but, as far as I know, the project is not compliant with EIP4337 yet (since they started to work on it before EIP4337 announcement).

&#x200B;

Thanks!"
6,2023-04-25,Staked eth - compounding,106,https://www.reddit.com/r/ethereum/comments/12yx219/staked_eth_compounding/,10,"Do the staking rewards compound on coinbase?

For example (making up numbers) let’s say I have 1 eth staked. My reward after 3 days on coinbase is 0.1, so total of 1.1 eth staked. So my next reward will be a percentage of the 1.1 eth?"
7,2023-04-26,Learn Web3 Development @ useWeb3,39,https://www.useweb3.xyz/,3,
8,2023-04-25,Here's the first app on Ethereum re-staking network Eigen Layer called Omni,63,https://www.theblock.co/post/228112/recursive-looks-to-connect-rollups-with-eigen-layer-based-omni-network,2,
9,2023-04-25,Using 2 different crypto platforms.,47,https://www.reddit.com/r/ethereum/comments/12ywzni/using_2_different_crypto_platforms/,16,"Me and my friend have made an account on Revolut (currently using and investing on ETH).

I have also created another account only for me on another crypto application ( capital.com ).

I didn’t invest yet on capital.com and if I do I will just give 10/20 euro an months.On Revolut we are putting the same amount of money 100 euros per person. 

Should I also invest on the other platform or not?

Ps ,we trust each other I have all his information and everything so we can’t just steal our money."
10,2023-04-25,"What futuristic movie do you associate Ethereum with? For whatever reason I associate Ethereum and ""Logan's Run"" and ""The Time Machine"". What is your opinion?",38,https://www.reddit.com/r/ethereum/comments/12ys1pa/what_futuristic_movie_do_you_associate_ethereum/,11,"I'm not sure if it is the academic nature of Ethereum, it's proposed use cases, it's image in the media, my interactions with people on r/ethereum of where I get these impressions.  What are yours?"
11,2023-04-25,State of the DAOs - April 25th,66,https://twitter.com/DexeNetwork/status/1650921505360846850,3,
12,2023-04-25,Repurposing NFT (ERC-721),91,https://www.reddit.com/r/ethereum/comments/12yj8m3/repurposing_nft_erc721/,18,"Hi,

Looking back at sh\*tshow that was 2021s NFT hypermania, much of these ~~projects~~ scams are now useless (either through rugpull or some other fraud).  


That said, these ERC721 tokens still exist on the network, and to my knowledge many if not most have not been deleted or burned. 

Would it be  possible to repurpose these tokens with code to represent some other asset (or  whatever  really) that isnt a pixelated monkey or fish?"
13,2023-04-25,Proof of Identity by placing a shoe on your head (ERC721),16,/r/ethdev/comments/12yq3d1/proof_of_identity_by_placing_a_shoe_on_your_head/,1,
14,2023-04-25,Curve Newsletter,34,https://www.reddit.com/r/ethereum/comments/12yrrfh/curve_newsletter/,4,"Hi guys.  
If you don't already know it, this is Curve Finance newsletter. If you don't have time to be 24-7 on Twitter. This is a good way to follow what is happening  
[https://cryptouf.substack.com/p/whatup-on-curve-129](https://cryptouf.substack.com/p/whatup-on-curve-129)

And because Twitter's links are not working properly since last week:.. on Mirror:  
[https://mirror.xyz/dashboard/edit/MSX4cU0c81-gAaeIhyRUPy7Xg8pK3qSoq-6yca\_Gj2U](https://mirror.xyz/dashboard/edit/MSX4cU0c81-gAaeIhyRUPy7Xg8pK3qSoq-6yca_Gj2U)"
15,2023-04-25,ETH transaction fees future,61,https://www.reddit.com/r/ethereum/comments/12yih0h/eth_transaction_fees_future/,11,"Hi,  


I was wondering if anyone could help me understand something. Given that ETH is deflationary, the cost to transact on the network theoretically trends towards infinity (not that it will, but costs to transact will  only ever get more  expensive).  


Does anyone see this as a limitation for the network? Can there not be a vote to propose lowering and adjusting fees as the network expands?"
16,2023-04-25,Unstaking,8,https://www.reddit.com/r/ethereum/comments/12yst0j/unstaking/,13,I just staked some ETH.  I’m on Binance.  When will it let me unstake?  How long will the unstaking process take?
17,2023-04-25,Simplifying DeFi transactions via Enso V2,4,https://blog.enso.finance/post/introducing-enso-v2,2,
18,2023-04-25,Ethereum and Saved process (A gas fee question),30,https://www.reddit.com/r/ethereum/comments/12yotpo/ethereum_and_saved_process_a_gas_fee_question/,6,"Hello Eth community,

I've been looking into depositing some rEth into Aave but before I go ahead and do it I would like to ask if I have understood the fees I can expect to pay reasonably well.

Due to fees I haven't used main chain very much for years.

Here's is my idea of how it would roughly look like:

3.31, withdraw cex

15.6, swap to reth

20.5 approve reth spend

20.5 deposit

20.5, approve borrow coin

20.5, eithdraw borrow coin

20.5, repay borrow coin

20.5 withdraw rEth

total: ~142 usd


How does this sound to you guys?"
19,2023-04-25,"DeFi in Ether: $48B in DeFi, The Uniswap wallet is now live, The 0x team introduced the all-new 0x…",37,https://medium.com/paradigm-research/defi-in-ether-48b-in-defi-the-uniswap-wallet-is-now-live-the-0x-team-introduced-the-all-new-0x-37418a3fc92e,3,
20,2023-04-25,How Ethereum smart contracts are revolutionizing industries,35,https://nbx.com/blog-en/the-power-of-ethereum-how-smart-contracts-are-revolutionizing-industries,9,
21,2023-04-25,Rebalancing Validators after staking unlocked?,67,https://www.reddit.com/r/ethereum/comments/12y2mfj/rebalancing_validators_after_staking_unlocked/,10,"e.g. on [https://beaconcha.in/pools](https://beaconcha.in/pools)

I see Coinbase went from 59,004 validators on April 14, 2023 to...

56,128 validators today, April 24, 2023...

Did you sell, self-stake, redistribute your stake?

Adding... Gemini showed as 796 validators on April 14, 2023 and is now showing as just 22 validators on April 24, 2023.

Here is screenshot I took on April 14, 2023 - from link above.

https://preview.redd.it/zmtzgdwfhxva1.png?width=480&format=png&auto=webp&v=enabled&s=53efce1d343fed44472f499dc4307ff98d16a26a"
22,2023-04-25,EthAustin underway!,2,https://www.reddit.com/r/ethereum/comments/12yov0j/ethaustin_underway/,2,"First panel of the day! 

Chainlink
Connecting Web3 To The World’s APIs

Sponsors; Ethereum Austin & Dystopia Labs[](https://i.imgur.com/E65LQEm.jpg)"
23,2023-04-24,Gas fee alert ios app is released,118,https://www.reddit.com/r/ethereum/comments/12xx541/gas_fee_alert_ios_app_is_released/,2,"Couple weeks ago I posted a lookup for beta testers. Thanks everyone for helping debug this app. It was a huge help.
App is free to use. Might not be for everyone, since they are already a lot of L2 solutions that deprecate this use case, but my friend had a need for this type of stuff, so I figured there could be someone else as well.

[App Store](https://apps.apple.com/us/app/gas-eth-alerts/id6446234870)"
24,2023-04-24,The Next Chapter in Ethereum's Evolution: A Deep Dive into the Latest Scalability Innovations,117,https://www.reddit.com/r/ethereum/comments/12xswia/the_next_chapter_in_ethereums_evolution_a_deep/,17,"Blockchain scalability especially Ethereum scalability remains a hot topic with the network's inherent limitations still inherent. This has led to the launch of many scaling solutions known as Layer-2 (L2) scaling solutions with most solutions differing from the others. The 4 prominent approaches taken are:

\-Sidechains (although many argue that it's not an L2. Example is Polygon and xDAI)

\- State channels (Connext, Celer, etc.)

\- Rollups which are divided into Optimistic (Arbitrum, Optimism, Cartesi, etc.) and ZK Rollups (Starknet, zkSync, Loopring, dYdX, etc.)

\- Nested Channels/Plasma such as OMG Network.

Arbitrum is the latest in the L2 wave after a successful token launch. A general-purpose optimistic rollup, Arbitrum is designed to improve speed and privacy while reducing txn fees on Ethereum networks significantly.

Then there is Cartesi, an application-specific optimistic rollup scaling solution that is approaching a [mainnet-ready stage](https://medium.com/cartesi/cartesi-ecosystem-update-2023-124b384401cc) with the scheduled release this year. Cartesi rollups offer lots of advantages like individual high-performing rollup chains for DApps in the Cartesi ecosystem, no competition of blockspace, and the same strong security and privacy of the underlying blockchain. These rollups can be deployed as layer 2 on top of Ethereum, layer 3 on top of L2s, or as sovereign Rollups.

The launch of the Cartesi mainnet will allow developers to break free from the current limitations of Ethereum VM and allow them to build DApps that can handle complex use cases. Don't miss the chance to learn more about Cartesi and how it can help you build more powerful DApps using familiar stacks and libraries at their upcoming [meetup](https://www.meetup.com/ethmalaysia/events/292992230/).

The future of Ethereum scalability is promising, and it is exciting to witness the evolution of this technology as we move towards a more decentralized and efficient world."
25,2023-04-25,Vitalik Buterin Is Planning to Visit India,0,https://www.reddit.com/r/ethereum/comments/12yngaz/vitalik_buterin_is_planning_to_visit_india/,4,"Vitalik Buterin, co-founder of Ethereum, and Sadhguru, an Indian guru and an environmental activist, discussed technology, blockchains, and human conscience. Following this, Vitalik confirmed his interest in visiting India to join Sadhguru at his Isha Foundation. 

[https://youtu.be/wqhExnIRLZc](https://youtu.be/wqhExnIRLZc)"
26,2023-04-24,Just started with ETH (beginner),75,https://www.reddit.com/r/ethereum/comments/12xtbsk/just_started_with_eth_beginner/,93,"A week ago me and my friend (18/19 old) we started to invest in ETH (we putted €185). I also look everyday to crypto predictions.com to know when we should put money on or sell it.

We are seeking for advice to make much more profit ? 

Ps. We put like every month ( when the ETH is lower value 100 for person = 200 euros.

Do u have any advice for us?"
27,2023-04-25,does staking small amounts of eth worth it?,1,https://www.reddit.com/r/ethereum/comments/12yde97/does_staking_small_amounts_of_eth_worth_it/,33,"So lets say i want to stake 1k in eth with a 5% a year reward thats 50$ in rewards for 1 year. Just by swapping and moving my eth will cost more in fees and gas, why would someone want to stake small amounts? Is my math wrong"
28,2023-04-24,SMTChecker: The Game Changer in Smart Contracts Verification and Security,56,https://www.truscova.com/blog_article_15.php,1,
29,2023-04-24,Video explaining Data Availability and why it's important,112,https://youtu.be/dwEv77qrQeE,1,
30,2023-04-24,Best way to stake ETH stored in Ledger wallet?,66,https://www.reddit.com/r/ethereum/comments/12wxlo4/best_way_to_stake_eth_stored_in_ledger_wallet/,105," Hi everyone,

I've been holding onto some ETH for a while now and I want to start staking it to earn some rewards. However, I'm not sure what the best way to go about this is. My ETH is currently stored in my Ledger wallet, so I'm wondering if anyone has any recommendations for the best way to stake it from there.

I've heard of Kiln and Lido as options for staking, but I'm not sure which one is the safest to use. Has anyone had experience staking with either of these platforms? Are there any other options that I should consider?

Any advice or insights would be greatly appreciated. Thanks in advance!"
31,2023-04-24,Preventing Slashed Validators from Becoming Block Proposers,5,https://etherworld.co/2023/04/24/preventing-slashed-validators-from-becoming-block-proposers/,1,"Background, Proposed Mitigation, Associated Trade-Offs & Why implement this change?"
32,2023-04-24,Staking,109,https://www.reddit.com/r/ethereum/comments/12x0bqw/staking/,23,"I’m currently hold my ETH on Huobi exchanger and wants to stake it under the ETH 2.0. From what I understand, I staked my ETH on the platform, and getting BETH as a reward. I also was informed that BETH gonna have a market value of the same with ETH.

But can I withdraw my staked ETH anytime and does BETH actually can be converted to ETH sooner or later ? Does anyone can explain to me ?"
33,2023-04-23,"A single MEV bot jaredfromsubway.eth paid $530K in gas in the last 24h, representing 5%of the total gas paid in the Ethereum network",0,https://twitter.com/SeaLaunch_/status/1650212069654790152?s=20,66,
34,2023-04-23,"Smart Contracts: Why even brother asking for ERC20 approval, if it can give itself the approval anyways?",78,https://www.reddit.com/r/ethereum/comments/12wuiwi/smart_contracts_why_even_brother_asking_for_erc20/,16,"I was writing my first smart contract interacting with ERC20 tokens and I realised one thing:

While, for the tokens I work with, I need a token allowance to have the smart contract be able to spend it, I realised, that my smart contract could also simply just **itself invoke** the ERC20 [approve](https://github.com/OpenZeppelin/openzeppelin-contracts/blob/master/contracts/token/ERC20/IERC20.sol#L66) function and give itself the allowance it needs to process my tokens.

While this may be convinient for my smart contract, I think this is highly problematic for the smart contracts in the wild. I mean, doesn't that mean, that as soon as I interact with a malicious smart contract, that it can simply give itself ALL approvals for the most common tokens and thereby drain the account? Is this the reason, why people say ""don't interact with smart contracts""?

Do I understand this situation correctly?

Not only is this problematic, but this also actually completely *negates the whole purpose of the allowances*. I mean, why does uniswap *even brother* to ask me for an approval and make one swap into two tx (approve + swap)? If I have to trust uniswap anyways to not make a malicious token approval call, then they might as well just approve the amount for the swap and execute the swap together in the same tx. Right?

What do you think? Am I missing something?

If this is really the way I describe, wouldn't it be necessary to implement guard-checks on the *msg.sender* side? Concretely, It would make more sense to have some kind of *account-side function approval*, where an account itself can specify, whether a certain function of a certain contract can be called by a smart contract or not. I could then say, that e.g. only Uniswap *even can call the approve function* of a token and any other contract attempting to call it would immediately revert. I think this is not implemented in the ecosystem and would need to be an EIP... right?"
35,2023-04-23,Creating many seed phrases from hardware wallets,48,https://www.reddit.com/r/ethereum/comments/12wq548/creating_many_seed_phrases_from_hardware_wallets/,14,"I would like to create seed phrases for use in a software-based wallets and applications. But, I want these seed phrases to be derived from my hardware wallet, so with access only to the hardware wallet I can recreate the seed phrases. I want to generate potentially many of these, so it would be burdensome if I had to manage seed phrases for these new wallets separately. Also, these must be seed phrases and not just individual keys derived from the same HD wallet, since the many different applications I use them in only accept seed phrases.

Is there a standard for doing this in a way that does not expose my hardware wallet private key(s)?

I have come up with a method for generating seeds from my hardware wallet, without exposing the hardware wallet's seed phrase or private key, and I would like to know if it is sound.

1. Sign a particular message with your hardware wallet, such as ""My software wallet 156""

2. Double check that the signature is correct by recovering the public key from the signature using the message ""My software wallet 156"" (Optional check)

3. Take the keccak256 hash of the signature

4. Convert the hash to a 24-word seed phrase using BIP-39

Because in Ethereum we assume the one-wayness of the keccak256 hash, I think this should be a secure way of deriving a seed phrase (but, I am unsure). Also: I am signing these messages with my hardware wallet, so I do not leak the seed phrase or private keys of the hardware wallet. No one else can produce the signature as long as I keep the signature secret, and I assume my computer is trustworthy.

Possible threats:

1. If someone tricks me into signing the same message, thereby revealing the signature to them, the person can derive my seed and steal my funds. I will assume that no one can trick me into doing this, and that no one else ever has access to my hardware wallet.

2. Do different wallets sign messages in different ways? Signing the same message multiple times on my hardware wallet yields the same signature, so I assume the signature parameters are derived deterministically from the message contents. But, if a wallet signs the same message differently than when I first derive the seed, the seed might become irrecoverable.

3. Forgetting the message. I can store the message or message pattern along side my paper seed phrase backup so I cannot forget it. Storing the message pattern is compact, and I won't have to amend the paper backup every time I want to create a new software seed.

Thoughts?"
36,2023-04-23,In my opinion social governance is superior to token governance for L1s as well as L2s.,120,https://www.reddit.com/r/ethereum/comments/12wbxqs/in_my_opinion_social_governance_is_superior_to/,10,"I love Ethereum and its governance model. I think it is superior to other L1s which have token governance enshrined. It will lead Ethereum to eventually ossify its protocol which imo is essential to the longterm success and the deep trust in the Ethereum Protocol. My current problem with L2s is they go the path of token governance which will never completly ossify. I know for example optimism would be easy to fork and create a version with no governance. The problem I see is all current major L2s that have or will have some kind of governance are building up a huge network effect, that other L2s with no governance in future will have a hard time to compete. What do you think about it?"
37,2023-04-23,"Trust Wallet Vulnerability, Around $170K Stolen",20,https://twitter.com/unsnarl_secure/status/1650137261055578113,1,A WASM vulnerability was reported in Trust Wallet's open-source library through their bug bounty program in November 2022.
38,2023-04-22,Core Devs progress: Ethereum's next upgrade after Shanghai is called 'Cancun-Deneb',173,https://www.theblock.co/post/227746/ethereum-shapella-cancun-deneb,23,
39,2023-04-22,"StakeBoard v1.1 is live, an Ethereum-focused staking dashboard app",32,/r/CryptoCurrency/comments/12vg094/stakeboard_v11_is_live_an_ethereumfocused_staking/,5,
40,2023-04-22,Can a hacker/malware copy my address except for 3 characters?,79,https://www.reddit.com/r/ethereum/comments/12v6b9o/can_a_hackermalware_copy_my_address_except_for_3/,46,"Hello,

Just want to confirm if i've been hacked or not. I wanted to take some ETH off Kraken and put it onto my ledger so I copied the address and pasted it into Kraken. The first and last 10 characters were the same so I hit go. When checking the ethereum explorer, I can see the transaction has gone through but I never received anything, I then checked the address I copied from my Ledger with the address Kraken used, and they're not the same, 3 characters in the middle of the address have been mixed up.

Is it possible to create an Ethereum address of your own choosing? The only way I can see how this would've been done is that my computer is compromised, and when I copied the address, the malicious software, hijacks my copy/paste, creates a new Ethereum address and steals it that way.

I literally only got the computer a month ago from Scan (formatted without an OS) and haven't done anything with crypto at all on it until today.

What should I be doing now? Formatting again? Thanks for any help :("
