,Date,title,score,url,num_comments,body
223,2023-04-08,"Another horror story: 54 NFTs worth over $50,000 and 3.4 ETH were stolen due to a seed phrase hack",133,https://www.reddit.com/r/ethereum/comments/12g0fp7/another_horror_story_54_nfts_worth_over_50000_and/,139,"[https://twitter.com/ivan\_bezdomny/status/1644612828601503749](https://twitter.com/ivan_bezdomny/status/1644612828601503749)

54 NFTs worth over $50,000 and 3.4 ETH were stolen today due to a compromised seed phrase. The holder used MetaMask, no hardware wallet. Unclear where the seed phrase was stored.

Edit: there have been a lot of comments from the purists that think people store their ledger seeds in the safe of on steel plates. I know this is the right way to it. However, the reality is that most people take photos of their seeds and store them online or type them online and store in cloud drives, unfortunately. A ledger user have just posted that their assets got stolen after taking a photo of the ledger seed and store on their phone https://www.reddit.com/r/ledgerwallet/comments/12gsic1/have_i_been_robbed/?utm_source=share&utm_medium=ios_app&utm_name=ioscss&utm_content=1&utm_term=1 . 

How can we, as the industry, mitigate the issues related to self-custody, so we have greater and safer adoption of Ethereum?"
224,2023-04-09,What kind of wallet does web3 company use? (Custodial/non custodial/cold wallet),12,https://www.reddit.com/r/ethereum/comments/12g9ol8/what_kind_of_wallet_does_web3_company_use/,12,"Hey guys,

Is there anyone knows what kind of wallet web3 company usually use? Is it custodial wallet or do they use cold wallet?"
225,2023-04-09,Physics Simulations on the Ethereum Blockchain,22,https://www.reddit.com/r/ethereum/comments/12g3jsi/physics_simulations_on_the_ethereum_blockchain/,3,"A topic that some of you might find interesting. Now read aloud by AI.  
[https://youtu.be/vGu255x6QiQ&ab](https://youtu.be/vGu255x6QiQ&ab)"
226,2023-04-09,SecureWithUnsnarl Weekly Ledger 📓: 2nd to 8th April 2023,4,https://twitter.com/unsnarl_secure/status/1644953697317945344,0,"We are the winners🏆 of @stark_con Grants Program for builders on
@Starknet! 🎉🚀

Our Team investigated 🔍 @CoinMatchAi Project.

Insightful 🧠🧵 on Challenges & Limitations of Traditional #Web3 Auditing 🛡️

@Reddit launches the 3rd generation of its ""#Reddit Avatars"" on
@0xPolygon #blockchain. 🚀🌐

We identified Common Problems Faced by Independent Auditors in #Web3. 🔍🔒

Lastly, Huge Congratulations 🎊 to @ankit7241 for 3rd place 🥉 in #Web3 INIT Hackathon."
227,2023-04-08,What’s the cheapest way to swap StEth for Eth?,22,https://www.reddit.com/r/ethereum/comments/12g172g/whats_the_cheapest_way_to_swap_steth_for_eth/,27,"Thinking about unstaking my StEth on lido before the Shanghai upgrade. The suggested providers (1inch and paraswap) are quite expensive imo.

Any suggestions?"
228,2023-04-08,"zkSync's Fix for 921 ETH, Eigenlayer on Testnet & more Web3Today #21",72,https://youtu.be/ypG1TvKFGx4,5,"- @zksync's fix for 921 $ETH
- @eigenlayer launches on #testnet
- @RampNetwork to support @zksync 
- @BuildOnBase Quest
- @aevoxyz on #mainnet"
229,2023-04-08,Latest Week in Ethereum News,82,https://weekinethereumnews.com/week-in-ethereum-news-april-8-2023,6,
230,2023-04-07,The Ethereum Project Visualized with Gource,166,https://www.youtube.com/watch?v=SwAPjdWspEA,9,
231,2023-04-08,Private placement in Eth?,36,https://www.reddit.com/r/ethereum/comments/12fc6tn/private_placement_in_eth/,14,"Hi guys, I just finished coding on a small DApp that might go places. Now that there is a working product, it feels to me like a good place to raise some funds for further development and marketing. 

Rather than fiat tho, I would like to raise funds in Eth since my revenues are in Eth. Is there a way I could raise a small amount of Eth for my project quickly online without going through an ICO or chasing VCs?"
232,2023-04-08,Simplicity of EIP-2535 Diamonds Standard,1,https://eip2535diamonds.substack.com/p/simplicity-of-eip-2535-diamonds-standard,1,
233,2023-04-07,U.S. Senate Is Pushing to Ban Crypto Wallets,258,https://crypto-beat.medium.com/u-s-senate-is-pushing-to-ban-crypto-wallets-1ad769a71b8c,140,
234,2023-04-07,Verkle Trees Research Progress,43,https://etherworld.co/2023/04/07/verkle-trees-research-progress/,3,"- Verkle Testnets
- Insights & Bugs
- Potential Challenges
- zkEVMs Vs Verkle Trees 
- Development Progress


Verkle trees can provide more efficient proof sizes than Merkle trees, making stateless clients viable by reducing proof sizes."
235,2023-04-07,What's the best why to stake Ethereum?,24,https://www.reddit.com/r/ethereum/comments/12eyey8/whats_the_best_why_to_stake_ethereum/,47,I'm so confused on the difference between stETH and rETH. I wish I could just become a validator and earn the rewards. What do you use to stake your ETH? Do you stake on layer 1 or layer 2? If you stake on layer 2 what network/dapp do you use?
236,2023-04-07,ZkSync develops solution to unfreeze $1.7 million stuck in a smart contract,177,https://www.theblock.co/post/225364/zksync-unfreeze-millions-stuck,14,
237,2023-04-07,Lido has completed a key rotation ceremony,64,https://www.reddit.com/r/ethereum/comments/12en7s7/lido_has_completed_a_key_rotation_ceremony/,6,"Lido has completed a key rotation ceremony for its withdrawal credentials. The ceremony involved signing all withdrawal credential messages, from 0x00 to 0x01, and these messages are now ready to be broadcasted to the Ethereum network after the Shapella hard fork on April 12th.  


With Ethereum withdrawals on the horizon, these credentials need to be rotated from 0x00 to 0x01, as the former must be migrated to the latter before partial and full withdrawals can be completed. This rotation is enabled by the Shapella hard fork.  


This was the first news I ran across today, second one was this strange Twitter acc [3ST](https://twitter.com/3SToken), dunno what to think, so because of my curiosity I needed to share it with you guys to see does anyone know what's that about.   


As I read the first rotation message was successfully signed and verified by a node 2.5 weeks ago, and as of last Friday, all 18,632 messages have been signed and validated. However, the messages will only be broadcasted to the network after the Shapella hard fork, meaning that the rotations will not occur until after the fork is live.  


Once the hard fork is complete, all Lido validators on Ethereum will be using 0x01 withdrawal credentials."
238,2023-04-07,How do I cash out my eth2?,28,https://www.reddit.com/r/ethereum/comments/12eai6d/how_do_i_cash_out_my_eth2/,60,"I am unfamiliar with crypto and bought some ethereum a couple years ago. I did end up staking it and it’s ethereum 2 now. Can I cash it out? I don’t see the option, but I need some quick cash. Not asking for opinions on whether I should, just how. I use coinbase."
239,2023-04-07,How Does Tornado Cash Work?,15,https://www.zellic.io/blog/how-does-tornado-cash-work,8,
240,2023-04-06,They’re afraid,144,https://www.wsj.com/articles/decentralized-cryptocurrency-markets-threaten-u-s-national-security-treasury-says-d9dd324f,28,
241,2023-04-06,NFTs have the potential to change the ticketing game forever,159,https://www.reddit.com/r/ethereum/comments/12djigi/nfts_have_the_potential_to_change_the_ticketing/,146,"Ticketing issues seem to be more and more common: The Rolling Stones concert in 2016, the 2017 Fyre Festival fiasco, Beyonce and Jay-Z’s 2018 “On the Run” tour, and most recently, Taylor Swift’s Era tour debacle.  


Many believe that large-scale ticketing giants have held a monopoly on event hosting for the world’s crème de la crème. But I think the only answer to all issues related to tickets is NFTs.  


The issues with the global ticketing industry are well-documented at this point. Bot-based tech has us fighting due to dynamic pricing and getting into a mode of panic buying. Then there are hidden fees, queues and scams, scalping, counterfeiting, pricing wars in the resale market, and more. We can agree that it’s unfair and unethical. The industry’s in desperate need of more transparency and authenticity.  


NFTs have the potential to change the ticketing game forever, I even bought one NFT ticket last year for a music festival. I've seen on ReelStar how artists may benefit thanks to NFTs, so NFT ticketing is just another plus for them.   


NFT ticketing could provide a more flexible and customizable ticketing experience for fans. For example, event organizers could create special NFT tickets for VIP experiences or exclusive events, or allow fans to purchase collectible NFT tickets that could increase in value over time.  


Have you ever bought an NFT ticket so far?"
242,2023-04-06,"A project on zkSync raised 921 ETH ($1.7M) in a token sale, but funds are stuck forever in the smart contract. Always remember guys, EVM compatible =/= EVM equivalent.",40,https://twitter.com/0xedenau/status/1644016993996247040,15,
243,2023-04-06,PEEPanEIP-4844: Shard Blob Transactions with Terence & Kasey,22,/r/ethstaker/comments/12d2mwm/peepaneip4844_shard_blob_transactions_with/,1,
244,2023-04-06,Why you should report your 2022 crypto losses on your taxes (you can save a ton of money),42,https://www.reddit.com/r/ethereum/comments/12dp6os/why_you_should_report_your_2022_crypto_losses_on/,15,"*‘I don’t need to report crypto on my taxes because I didn’t take profits last year.’* 

I hear this pretty often both IRL and on Reddit, and it’s important to remember that this statement is a bit of an oversimplification.

It’s true that you don’t need to pay capital gains tax if you didn’t realize gains on crypto. However, reporting your cryptocurrency losses can help you save a ton of money in taxes. 

*(Disclaimer: I’m not a tax professional and you should do your own research before you sell your crypto/file your taxes. )*

**What’s the benefit of reporting crypto losses?** 

When you realize losses in crypto, you can offset capital gains from cryptocurrency, stocks, and other assets as well as up to $3,000 of income for the year! If you have a net loss for the year, you can even offset capital gains in future years. 

Let’s say you lost $100,000 in 2022 (I really hope this didn’t happen to anyone reading this). In this case, you can write off $3,000 of income this year and carry forward $97,000 of loss to write off gains in future years! This can save you a HUGE amount in taxes if you end up taking profits during the next bull run. 

**What do you mean by ‘realized’ loss?** 

A ‘realized’ loss basically just means you disposed of your cryptocurrency for a lower price than it was when you originally acquired it. 

Examples of disposals include selling your cryptocurrency, trading it for another crypto, or using your cryptocurrency to make a purchase. 

If you just held your cryptocurrency for all of last year, you didn’t ‘realize’ a loss. Unfortunately, that means you can’t write off your loss on your tax return. 

**‘But, reporting my crypto losses sounds like way too much work!’** 

There’s no reason not to report your capital losses on your taxes. If you’re using a crypto tax platform (like [CoinLedger](https://coinledger.io/), Koinly, CoinTracker, or whatever else is out there now), it should only take a few minutes. All you need to do is connect your wallets and exchanges and let the platform do the work for you. 

**TL;DR**: Reporting your crypto losses can help you save money on your tax bill."
245,2023-04-06,Shanghai hardfork scheduled next week...,23,https://www.reddit.com/r/ethereum/comments/12dty95/shanghai_hardfork_scheduled_next_week/,2," 

* The Shanghai hardfork is scheduled for next week and will enable Ethereum validators to withdraw their staked ETH and rewards.
* Validators have staked over 18M ETH (\~$32B) in the deposit-only staking system.
* Staking rewards (partial withdrawals) will be automatically available after the hardfork, while full withdrawals (staking rewards + 32 ETH) will have stricter rate-limiting rules.
* Shanghai may increase the amount of ETH staked due to the reduced duration risk of staking.
* Liquid staking protocols like Lido and centralized exchanges like Coinbase will still be relevant, helping investors bypass the 32 ETH staking requirement.
* The hardfork marks a pivotal moment in Ethereum's history as it completes its transition to proof-of-stake.

After the Shanghai upgrade completes, consider...

* Monitoring the **market impact of unlocked ETH and rewards**.
* Evaluating staking opportunities, as the hardfork may increase the amount of ETH staked.
* Keeping an eye on liquid staking protocols and centralized exchanges that could benefit from increased staking activity."
246,2023-04-07,EIP-2535 Diamonds use a better pattern for initializing state variables at deployment,0,https://medium.com/@gweiworld/a-new-better-way-to-initialize-upgradeable-contracts-39080d72f066,2,
247,2023-04-06,"""Aragon’s New DAO Toolkit on Polygon Takes Aim at Voter Apathy"" Article from Decrypt",10,/r/aragonproject/comments/12dsfl9/aragons_new_dao_toolkit_on_polygon_takes_aim_at/,2,
248,2023-04-06,Xircus Web3 Protocol is gearing up to collaborate with Draper Startup House,1,https://www.reddit.com/r/ethereum/comments/12dntso/xircus_web3_protocol_is_gearing_up_to_collaborate/,2,"Xircus Web3 Protocol is gearing up to collaborate with Draper Startup House, which is part of Tim Draper’s investor’s funding network; a global network and ecosystem for businesses that offers mentorship, support for entrepreneurs, and learning opportunities."
249,2023-04-05,Expected Changes on Beacon Chain with Shapella Upgrade,68,https://etherworld.co/2023/04/05/expected-changes-on-beacon-chain-with-shapella-upgrade/,2,"- Naming 
- Networking
- Validators' Responsibilities,
- Fork Choice
- Independent State & Block Historical Accumulators

Shapella Upgrade is successfully tested on devnets and public testnets. 

Ethereum Mainnet upgrade is scheduled for April 12th. 

Shanghai is the execution layer upgrade, whereas Capella will upgrade the consensus layer of the Ethereum Blockchain."
250,2023-04-05,What site is reputable at Ethereum mixing?,39,https://www.reddit.com/r/ethereum/comments/12cyrbu/what_site_is_reputable_at_ethereum_mixing/,35,"I did some research in to crypto mixing, So far I found these to sites for mixing ethereum:

[https://www.bitmixing.net/eth.html#start](https://www.bitmixing.net/eth.html#start)

&

[https://ipfs.io/ipns/tornadocash-ipfs.eth/](https://ipfs.io/ipns/tornadocash-ipfs.eth/)

What others will you recommend?"
251,2023-04-05,Echidna 2.1.1 released with fixes and reduced memory footprint!,45,https://github.com/crytic/echidna/discussions/1012#discussion-5048280,2,
252,2023-04-05,Fe moves out of alpha with the release of version 0.22.0,26,https://twitter.com/official_fe/status/1643674510137147392,1,
253,2023-04-05,Buying NFTs on the ZKSync Chain,19,https://www.reddit.com/r/ethereum/comments/12cuszc/buying_nfts_on_the_zksync_chain/,3,"We all know how buying and selling NFTs on the most popular blockchain, Ethereum, can be costly and slow due to high gas fees and network congestion.   


That’s why  I think it great how some NFT enthusiasts are turning to Layer 2 solutions, such as ZKSync, that offer faster and cheaper transactions without compromising on security or decentralization.  


Have you ever bought NFTs on the ZKSync Chain?  


I personally didn't since I don't buy 'em so much, I'm mostly on ReelStar, but I know tons of people who actually did that.   


ZKSync also supports smart contracts, which enable more complex and interactive NFT applications.  


Overall, ZKSync offers a promising solution to the challenges of buying and selling NFTs on the Ethereum blockchain, making it a worthwhile option for NFT enthusiasts looking for faster and cheaper transactions.  


What was your experience with ZKSync Chain and NFTs?"
254,2023-04-05,SecureWithUnsnarl: Top 10 Problems Faced by Independent Auditors in Web3,17,https://twitter.com/unsnarl_secure/status/1643634389031452672,5,"🚫 Traditional #auditing firms overshadow individual auditors. 

💼 Limited recognition for auditors' skills & expertise.

🌱 Small auditing firms with 5 - 10 auditors lack visibility. 

🏆 Difficulty competing with established brands & big firms.

💰 Limited demand for #auditing services due to perception of expense & unnecessary, leading to fewer job opportunities for auditors. 

🤝 Lack of trust in individual auditors, while trusting established brands.

🔍 Multiple auditors assigned to a single budget leads to low fees. 

💻 Difficulty in auditing early to medium-stage projects with low complexity, which may not have adequate funding for thorough audits.

💸 Difficulty in providing affordable auditing services while maintaining transparency & quality of work. 

💼 Lack of funds for auditing, compared to #scaling, product development, & team building.

💸 Difficulty in mitigating financial losses for startups due to security breaches, especially if they cannot afford expensive auditing services. 

📊 Lack of standardization & regulation in the auditing industry, leading to variable quality of audits and inconsistent pricing across firms."
255,2023-04-05,Ethereum projects come together on MEV Blocker RPC launch to share profits with users,39,https://www.theblock.co/post/225023/ethereum-projects-come-together-on-mev-blocker-rpc-launch-to-share-profits-with-users,7,
256,2023-04-05,Satellite orbiting Earth participates in the Ethereum KZG ceremony,104,https://www.investing.com/news/cryptocurrency-news/satellite-orbiting-earth-participates-in-the-ethereum-kzg-ceremony-3048326,9,
257,2023-04-05,EIPs Insight (March 2023),2,https://www.reddit.com/r/ethereum/comments/12d05cf/eips_insight_march_2023/,1,"📊 EIPs Insight (March 2023) 📊  


In March 2023, EIP authors promoted 7 EIPs to Final status, added 14 EIPs as Draft and 21 EIPs are moved to Stagnant status. Check out the full report 👇

[https://hackmd.io/@poojaranjan/EthereumImprovementProposalsInsight/https%3A%2F%2Fhackmd.io%2F%40poojaranjan%2FEIPsInsightMarch2023](https://hackmd.io/@poojaranjan/EthereumImprovementProposalsInsight/https%3A%2F%2Fhackmd.io%2F%40poojaranjan%2FEIPsInsightMarch2023)"
258,2023-04-05,About hardware wallets,34,https://www.reddit.com/r/ethereum/comments/12c7xvm/about_hardware_wallets/,24,"I saw a few threads about hardware and paper wallets, but I didn't find what I was looking for.

Some people claim that paper wallets are better than hardware wallets, but then how do they sign transactions? By hand?

The main benefit of a hardware wallet is that the transaction is signed INSIDE the hardware wallet and the private keys never leave it.

As soon as you send a private key to your mobile phone or computer, malware can steal it.

Of course, hardware wallets can be stolen and pins (even long-ish ones) can be recovered with enough computing power (gpu clusters) and specialized tools.

The most secure way would be to use a blank hardware wallet and reinitialize it each time with the seed phrase. No one can recover a seed phrase.

Anyway, my main concern is the following. Hardware wallets can't connect directly to the internet and are also usually connected to software wallets such as MetaMask. They receive transactions, sign them using the private key, and return the signed transactions.

The problem is that some malware is able to intercept and alter the transactions right before they reach the hardware wallet. Unless the hardware wallet shows the transaction data, including the calldata, there's no way to be sure we signed the correct transaction *before* sending it to the blockchain. Once we read it in the mempool or in a block, it's already too late!

**Question:** *do you know of any hardware wallet that shows, on its own display, both the destination address and the calldata of the transactions it's about to sign? [and ask for a confirmation, of course]*"
259,2023-04-04,Ralph Lauren's new Miami store is about to accept Ethereum,365,https://www.reddit.com/r/ethereum/comments/12bhzga/ralph_laurens_new_miami_store_is_about_to_accept/,44," According to Vogue Business, Ralph Lauren’s new Miami Design District store will accepting crypto. This will be the first Ralph Lauren store to accept crypto payments, and its launch includes a partnership with Web3 community Poolsuite.

Via crypto payment service Bitpay, the store will accept 3 cryptocurrencies including Ethereum (ETH).

Refunds will be provided in the cryptocurrency that was originally used and will be equal to the total dollar amount of what’s being returned (which adapts to the volatility in cryptocurrency values).

The brand is also partnering with Poolsuite (formerly internet radio station Poolsuite FM), whose NFT-gated membership is aligned with the Miami lifestyle. The first element of the partnership is a co-designed Ralph Lauren x Poolsuite NFT that will be gifted to all (approximately) 3,000 Poolsuite community members. This will unlock access to a party at a private waterfront Miami estate that is part of a three-day launch event later this month."
260,2023-04-05,Your Ultimate Guide to ETH Staking Withdrawals,2,https://www.reddit.com/r/ethereum/comments/12ch0xl/your_ultimate_guide_to_eth_staking_withdrawals/,2,"I just came across this awesome guide from Consensys!  
[https://consensys.net/shanghai-capella-upgrade/](https://consensys.net/shanghai-capella-upgrade/)"
261,2023-04-04,Come celebrate the Shanghai/Capella upgrade to Ethereum with us!,23,https://www.reddit.com/r/ethereum/comments/12bsyy5/come_celebrate_the_shanghaicapella_upgrade_to/,5,"Greetings, fellow Ethereans!

I'm excited to announce the upcoming Ethereum ""Shapella"" upgrade celebration!Shanghai on the execution layer and Capella on the consensus layer!

This significant milestone introduces withdrawals for staked ETH as well as other upgrades. More info([https://blog.ethereum.org/2023/03/28/shapella-mainnet-announcement](https://blog.ethereum.org/2023/03/28/shapella-mainnet-announcement))

To celebrate the upgrade, EthStaker is hosting a livestream event that will bring our amazing communities together. And as a special treat, we're inviting all of you to join us in creating a massive collaborative art piece during the event on a special [POAP.art](https://POAP.art) canvas! 🎨

Info:

Who? You! And your whole community! (tell your friends!)

What? Shanghai/Capella ""Shapella"" Upgrade  livestream and [POAP.art](https://POAP.art) party.

When? April 12th, paint party starts at 9:30 PM UTC, Ethstaker livestream starts at 10 (30 minutes later)

Where? [https://app.poap.art/](https://app.poap.art/) and [https://www.youtube.com/watch?v=BVq1pz3FrDo](https://www.youtube.com/watch?v=BVq1pz3FrDo)

How? Anyone can watch the livestream, To join the paint party: hold an eligible entry POAP (check the [poap.art](https://poap.art) page to see if you hold one), or claim the event POAP. \[[https://checkout.poap.xyz/d39e3416-a26f-41aa-bbca-2ee87781ffea/](https://checkout.poap.xyz/d39e3416-a26f-41aa-bbca-2ee87781ffea/)\]

Why? Great fun and exposure for your community!

&#x200B;

Spread the word, invite your friends, and let's make this the most memorable Ethereum upgrade celebration ever!

See you there!"
262,2023-04-04,"Registration for the Chainlink Spring 2023 Hackathon is open! $350K+ in prizes, world-class workshops with top devs, and much more 🔗",14,/r/ethfinance/comments/12bvdrd/registration_for_the_chainlink_spring_2023/,2,
263,2023-04-04,I need help swapping into Ethereum from BNB?,5,https://www.reddit.com/r/ethereum/comments/12bzd46/i_need_help_swapping_into_ethereum_from_bnb/,27,I've been attempting to do a direct swap between BNB on the BSC and ETH on mainnet and I cannot find a way to do it without an intermediate token swap. Can someone please enlighten me how to do this?
264,2023-04-04,Shapella Upgrade: Final Testing & Preparations,10,https://etherworld.co/2023/04/04/shapella-upgrade-final-testing-preparations/,2,"Shapella Progress
Erigon 2.42.0
Upcoming Client Updates
EIP Status Updates
Testing"
265,2023-04-04,Asset Tokenization: Unlocking the Potential of Real-World Assets,50,https://www.reddit.com/r/ethereum/comments/12beqr9/asset_tokenization_unlocking_the_potential_of/,9,"🔥 Hey everyone, we just published an insightful blog article on asset tokenization and its growing impact on various industries like real estate, art, and financial services.

🔐 As the world embraces tokenization, ensuring the security and integrity of smart contracts and blockchain platforms becomes more crucial than ever. That's where [Truscova](https://www.truscova.com/index.php) comes in! Our expert smart contract security auditing services help protect your investments and ensure the safe execution of blockchain-based applications.

👉 Here are some key takeaways from the blog:

* Learn how real asset tokenization works and its potential impact on different sectors
* Discover the importance of security auditing for tokenized assets

💡 Check out the full article here: [Asset Tokenization](https://www.truscova.com/blog_article_14.php)

We'd love to hear your thoughts and opinions on asset tokenization and its future. Feel free to share your experiences and join the discussion!"
266,2023-04-04,Intro to zkSync Era and the Revolution in Layer 2 Scaling Solutions,38,https://ethercto.com/blog/zksync-era-layer-2,4,
